{"normalized_schema_version":"as1.normalized.v1.2","source_schema_version":"as1.v1.2","raw_event_id":"sample-raw-event-001","satellite_id":"AS1","layout_id":"HORUS_A","observer":"HORUS","code_version":"sample-v1.2","source_profile_code":"CB_BTCUSD_SPOT_20260722_V1","canonical_regime_id":"coinbase-btcusd-spot-regime-001","instrument_key":"COINBASE:BTCUSD","registry_snapshot_version":"as1-source-profile-registry.v1.2","instrument":{"ticker_id":"COINBASE:BTCUSD","venue":"COINBASE","symbol":"BTCUSD","base_asset":"BTC","quote_asset":"USD","asset_class":"CRYPTO","market_type":"SPOT"},"session_context":{"session_type":"CONTINUOUS_24_7","session_state":"OPEN","is_market_open":true,"validated":true},"timing":{"timeframe":"60","bar_open_time":1785145200000,"bar_close_time":1785148800000,"sent_at":1785148801000},"bar":{"open":100000,"high":100250,"low":99850,"close":100100,"volume":123.45,"volume_unit":"BASE_ASSET","volume_basis":"EXCHANGE_NATIVE"},"quality":{"sensor_quality":"GOOD","valid":true,"flags":[]},"server_evaluation":{"schema_valid":true,"registry_validation_status":"WARN","registry_validation_flags":["REGIME_BOUNDARY_DATE_ONLY"],"received_at":1785148801500,"delivery_delay_seconds":0.5,"age_seconds":1.5,"freshness":"FRESH","accepted":true,"quarantine_reason":null},"dedup_key":"AS1|HORUS_A|coinbase-btcusd-spot-regime-001|60|1785148800000|as1.v1.2","payload":{"direction":"UP","note":"Illustrative normalized result; not live data."}}
